{
  "area": "export_wire",
  "spec": "HSDS-FX/§6.3",
  "reference_impl": "app/federation/merkle.py:verify_inclusion; app/federation/log.py:read_export",
  "interop_status": "interop_pending",
  "derives_from": "INTEROP_PENDING.md row 5 (the /export row shape + leaf=JCS(envelope minus id+proof)); the RFC-6962 inclusion algorithm is anchored in the merkle_inclusion area",
  "vectors": [
    {
      "id": "export-incl-001",
      "op": "verify_inclusion",
      "description": "INTEROP_PENDING (PPR /export row composition): the inclusion proof for export row sequence 1 verifies against the checkpoint root of the frozen size-3 tree. leaf_data = JCS(envelope minus id+proof), NOT the content-address — a PPR-native reading. The root/proof BYTES are app.federation.merkle self-derivations over these leaves (the RFC-6962 algorithm itself is anchored in the merkle_inclusion area).",
      "input": {
        "leaf_data_hex": "7b2240636f6e74657874223a2268747470733a2f2f687364732d66656465726174696f6e2e70616e747279706972617465726164696f2e6f72672f70726f66696c65222c226163746f72223a226469643a7765623a6578616d706c652e6f7267222c2261747472696275746564546f223a226469643a7765623a6578616d706c652e6f7267222c2266656465726174696f6e5f6964223a226578616d706c652e6f72673a6c6f632d30222c226c6963656e7365223a2273616e6469612d667467672d6e632d6f732d312e30222c226f626a656374223a7b226964223a226c6f632d30222c226e616d65223a2250616e7472792030227d2c226f726967696e223a226469643a7765623a6578616d706c652e6f7267222c227075626c6973686564223a22323032362d30362d30355430303a30303a30305a222c2273657175656e6365223a312c2274797065223a22557064617465227d",
        "m": 0,
        "n": 3,
        "proof_hex": [
          "18ac73892bac8389419dfed94b27b4826fd9f9fc5dd517bd1022c9d1bd8b8fae",
          "ddc0c2b535348efadc851fa7fe6233613dc5cb52d24794689574c37c77abe5e7"
        ],
        "root_hex": "7eabd54dc1e9036140eb22f5099e970e8f3144db6d035c4b1d921cc19038883e"
      },
      "expected": true,
      "must_reject": false,
      "interop_pending": true,
      "interop_row": 5
    },
    {
      "id": "export-incl-002",
      "op": "verify_inclusion",
      "description": "INTEROP_PENDING (PPR /export row composition): the inclusion proof for export row sequence 2 verifies against the checkpoint root of the frozen size-3 tree. leaf_data = JCS(envelope minus id+proof), NOT the content-address — a PPR-native reading. The root/proof BYTES are app.federation.merkle self-derivations over these leaves (the RFC-6962 algorithm itself is anchored in the merkle_inclusion area).",
      "input": {
        "leaf_data_hex": "7b2240636f6e74657874223a2268747470733a2f2f687364732d66656465726174696f6e2e70616e747279706972617465726164696f2e6f72672f70726f66696c65222c226163746f72223a226469643a7765623a6578616d706c652e6f7267222c2261747472696275746564546f223a226469643a7765623a6578616d706c652e6f7267222c2266656465726174696f6e5f6964223a226578616d706c652e6f72673a6c6f632d31222c226c6963656e7365223a2273616e6469612d667467672d6e632d6f732d312e30222c226f626a656374223a7b226964223a226c6f632d31222c226e616d65223a2250616e7472792031227d2c226f726967696e223a226469643a7765623a6578616d706c652e6f7267222c227075626c6973686564223a22323032362d30362d30355430303a30303a30305a222c2273657175656e6365223a322c2274797065223a22557064617465227d",
        "m": 1,
        "n": 3,
        "proof_hex": [
          "f16d90a814a15114b1d5c29587e58ecd4a3a6976234321b0bf34a5f640707871",
          "ddc0c2b535348efadc851fa7fe6233613dc5cb52d24794689574c37c77abe5e7"
        ],
        "root_hex": "7eabd54dc1e9036140eb22f5099e970e8f3144db6d035c4b1d921cc19038883e"
      },
      "expected": true,
      "must_reject": false,
      "interop_pending": true,
      "interop_row": 5
    },
    {
      "id": "export-incl-003",
      "op": "verify_inclusion",
      "description": "INTEROP_PENDING (PPR /export row composition): the inclusion proof for export row sequence 3 verifies against the checkpoint root of the frozen size-3 tree. leaf_data = JCS(envelope minus id+proof), NOT the content-address — a PPR-native reading. The root/proof BYTES are app.federation.merkle self-derivations over these leaves (the RFC-6962 algorithm itself is anchored in the merkle_inclusion area).",
      "input": {
        "leaf_data_hex": "7b2240636f6e74657874223a2268747470733a2f2f687364732d66656465726174696f6e2e70616e747279706972617465726164696f2e6f72672f70726f66696c65222c226163746f72223a226469643a7765623a6578616d706c652e6f7267222c2261747472696275746564546f223a226469643a7765623a6578616d706c652e6f7267222c2266656465726174696f6e5f6964223a226578616d706c652e6f72673a6c6f632d32222c226c6963656e7365223a2273616e6469612d667467672d6e632d6f732d312e30222c226f626a656374223a7b226964223a226c6f632d32222c226e616d65223a2250616e7472792032227d2c226f726967696e223a226469643a7765623a6578616d706c652e6f7267222c227075626c6973686564223a22323032362d30362d30355430303a30303a30305a222c2273657175656e6365223a332c2274797065223a22557064617465227d",
        "m": 2,
        "n": 3,
        "proof_hex": [
          "4ecd2250e16853e4cf2f8afb0ac4c5ca7aac27320b0ccaf90ab7ce8410756b0a"
        ],
        "root_hex": "7eabd54dc1e9036140eb22f5099e970e8f3144db6d035c4b1d921cc19038883e"
      },
      "expected": true,
      "must_reject": false,
      "interop_pending": true,
      "interop_row": 5
    },
    {
      "id": "export-incl-wrong-index-001",
      "op": "verify_inclusion",
      "description": "An inclusion proof for index 0 presented at index 1 MUST fail (RFC-6962 soundness over the PPR /export tree).",
      "input": {
        "leaf_data_hex": "7b2240636f6e74657874223a2268747470733a2f2f687364732d66656465726174696f6e2e70616e747279706972617465726164696f2e6f72672f70726f66696c65222c226163746f72223a226469643a7765623a6578616d706c652e6f7267222c2261747472696275746564546f223a226469643a7765623a6578616d706c652e6f7267222c2266656465726174696f6e5f6964223a226578616d706c652e6f72673a6c6f632d31222c226c6963656e7365223a2273616e6469612d667467672d6e632d6f732d312e30222c226f626a656374223a7b226964223a226c6f632d31222c226e616d65223a2250616e7472792031227d2c226f726967696e223a226469643a7765623a6578616d706c652e6f7267222c227075626c6973686564223a22323032362d30362d30355430303a30303a30305a222c2273657175656e6365223a322c2274797065223a22557064617465227d",
        "m": 1,
        "n": 3,
        "proof_hex": [
          "18ac73892bac8389419dfed94b27b4826fd9f9fc5dd517bd1022c9d1bd8b8fae",
          "ddc0c2b535348efadc851fa7fe6233613dc5cb52d24794689574c37c77abe5e7"
        ],
        "root_hex": "7eabd54dc1e9036140eb22f5099e970e8f3144db6d035c4b1d921cc19038883e"
      },
      "must_reject": true,
      "interop_pending": true,
      "interop_row": 5
    }
  ]
}
