{
  "area": "jcs",
  "spec": "HSDS-FX/§6.1 (RFC 8785 JCS canonicalization)",
  "reference_impl": "app/federation/canonical.py:jcs_bytes",
  "interop_status": "anchored",
  "derives_from": "vendor/jcs_rfc8785 (RFC 8785 official cyberphone vectors, verbatim)",
  "vectors": [
    {
      "id": "jcs-arrays-001",
      "op": "canonicalize",
      "description": "ANCHORED (RFC 8785, cyberphone 'arrays' vector): JCS-canonicalize the input to the published byte-exact output (hex). The vendored output bytes are the anchor; the impl must reproduce them.",
      "input": {
        "value": [
          56,
          {
            "d": true,
            "10": null,
            "1": []
          }
        ]
      },
      "expected": "5b35362c7b2231223a5b5d2c223130223a6e756c6c2c2264223a747275657d5d",
      "must_reject": false,
      "interop_pending": false
    },
    {
      "id": "jcs-french-001",
      "op": "canonicalize",
      "description": "ANCHORED (RFC 8785, cyberphone 'french' vector): JCS-canonicalize the input to the published byte-exact output (hex). The vendored output bytes are the anchor; the impl must reproduce them.",
      "input": {
        "value": {
          "peach": "This sorting order",
          "péché": "is wrong according to French",
          "pêche": "but canonicalization MUST",
          "sin": "ignore locale"
        }
      },
      "expected": "7b227065616368223a225468697320736f7274696e67206f72646572222c2270c3a96368c3a9223a2269732077726f6e67206163636f7264696e6720746f204672656e6368222c2270c3aa636865223a226275742063616e6f6e6963616c697a6174696f6e204d555354222c2273696e223a2269676e6f7265206c6f63616c65227d",
      "must_reject": false,
      "interop_pending": false
    },
    {
      "id": "jcs-structures-001",
      "op": "canonicalize",
      "description": "ANCHORED (RFC 8785, cyberphone 'structures' vector): JCS-canonicalize the input to the published byte-exact output (hex). The vendored output bytes are the anchor; the impl must reproduce them.",
      "input": {
        "value": {
          "1": {
            "f": {
              "f": "hi",
              "F": 5
            },
            "\n": 56.0
          },
          "10": {},
          "": "empty",
          "a": {},
          "111": [
            {
              "e": "yes",
              "E": "no"
            }
          ],
          "A": {}
        }
      },
      "expected": "7b22223a22656d707479222c2231223a7b225c6e223a35362c2266223a7b2246223a352c2266223a226869227d7d2c223130223a7b7d2c22313131223a5b7b2245223a226e6f222c2265223a22796573227d5d2c2241223a7b7d2c2261223a7b7d7d",
      "must_reject": false,
      "interop_pending": false
    },
    {
      "id": "jcs-unicode-001",
      "op": "canonicalize",
      "description": "ANCHORED (RFC 8785, cyberphone 'unicode' vector): JCS-canonicalize the input to the published byte-exact output (hex). The vendored output bytes are the anchor; the impl must reproduce them.",
      "input": {
        "value": {
          "Unnormalized Unicode": "Å"
        }
      },
      "expected": "7b22556e6e6f726d616c697a656420556e69636f6465223a2241cc8a227d",
      "must_reject": false,
      "interop_pending": false
    },
    {
      "id": "jcs-values-001",
      "op": "canonicalize",
      "description": "ANCHORED (RFC 8785, cyberphone 'values' vector): JCS-canonicalize the input to the published byte-exact output (hex). The vendored output bytes are the anchor; the impl must reproduce them.",
      "input": {
        "value": {
          "numbers": [
            333333333.3333333,
            1e+30,
            4.5,
            0.002,
            1e-27
          ],
          "string": "€$\u000f\nA'B\"\\\\\"/",
          "literals": [
            null,
            true,
            false
          ]
        }
      },
      "expected": "7b226c69746572616c73223a5b6e756c6c2c747275652c66616c73655d2c226e756d62657273223a5b3333333333333333332e333333333333332c31652b33302c342e352c302e3030322c31652d32375d2c22737472696e67223a22e282ac245c75303030665c6e4127425c225c5c5c5c5c222f227d",
      "must_reject": false,
      "interop_pending": false
    },
    {
      "id": "jcs-weird-001",
      "op": "canonicalize",
      "description": "ANCHORED (RFC 8785, cyberphone 'weird' vector): JCS-canonicalize the input to the published byte-exact output (hex). The vendored output bytes are the anchor; the impl must reproduce them.",
      "input": {
        "value": {
          "€": "Euro Sign",
          "\r": "Carriage Return",
          "\n": "Newline",
          "1": "One",
          "": "Control",
          "😂": "Smiley",
          "ö": "Latin Small Letter O With Diaeresis",
          "דּ": "Hebrew Letter Dalet With Dagesh",
          "</script>": "Browser Challenge"
        }
      },
      "expected": "7b225c6e223a224e65776c696e65222c225c72223a2243617272696167652052657475726e222c2231223a224f6e65222c223c2f7363726970743e223a2242726f77736572204368616c6c656e6765222c22c280223a22436f6e74726f6c7f222c22c3b6223a224c6174696e20536d616c6c204c6574746572204f205769746820446961657265736973222c22e282ac223a224575726f205369676e222c22f09f9882223a22536d696c6579222c22efacb3223a22486562726577204c65747465722044616c6574205769746820446167657368227d",
      "must_reject": false,
      "interop_pending": false
    }
  ]
}
